{
  "grant_type": "authorization_code",
  "client_id": "123456",
  "client_secret": "example_value",
  "code": "example_value",
  "redirect_uri": "example_value",
  "code_verifier": "example_value",
  "refresh_token": "main",
  "device_code": "example_value",
  "username": "Example Project",
  "password": "example_value"
}